{
  "$schema": "https://json-schema.org/draft/2020-12/schema",
  "$id": "urn:codeattest:protocol:v0:runner-release-record",
  "title": "Runner Release Record",
  "type": "object",
  "additionalProperties": false,
  "required": [
    "protocol_version",
    "release_identifier",
    "build_identifier",
    "artifact_digest",
    "released_at",
    "limitations"
  ],
  "properties": {
    "protocol_version": {
      "$ref": "urn:codeattest:protocol:v0:shared-definitions#/$defs/protocol_version"
    },
    "release_identifier": {
      "$ref": "urn:codeattest:protocol:v0:shared-definitions#/$defs/non_empty_string"
    },
    "build_identifier": {
      "$ref": "urn:codeattest:protocol:v0:shared-definitions#/$defs/non_empty_string"
    },
    "artifact_digest": {
      "$ref": "urn:codeattest:protocol:v0:shared-definitions#/$defs/algorithm_prefixed_sha256_id"
    },
    "released_at": {
      "$ref": "urn:codeattest:protocol:v0:shared-definitions#/$defs/utc_rfc3339_timestamp"
    },
    "limitations": {
      "type": "array",
      "maxItems": 100,
      "minItems": 1,
      "items": {
        "$ref": "urn:codeattest:protocol:v0:shared-definitions#/$defs/narrative_string"
      }
    }
  }
}
